{
  "$schema": "../schemas/policy-profile.schema.json",
  "schemaVersion": "2.0.0",
  "profileId": "baseline-artifact-signing",
  "profileVersion": "1",
  "status": "active",
  "effectiveAt": "2026-08-08T00:00:00Z",
  "expiresAt": null,
  "rules": [{
    "ruleId": "artifact-signing-default",
    "intent": "artifact-signing",
    "operations": ["ResolvePolicy", "CreateKey", "Sign", "Verify"],
    "decision": {
      "profile": "artifact-signing-v0",
      "algorithm": "http://www.w3.org/2021/04/xmldsig-more#eddsa-ed25519",
      "allowedProviderClasses": ["software"]
    }
  }]
}
